{
  "schema_version": "1.0-draft.1",
  "fixture_version": 1,
  "case_id": "frozen-dupe-medium-lexical",
  "attributed_from": {
    "notes": "GW-024 synthetic offline promotion pack"
  },
  "http_exchanges": [
    {
      "sequence": 0,
      "provider": "github",
      "match": {
        "method": "GET",
        "canonical_url": "https://api.github.com/repos/acme/widgets/issues/50",
        "request_body_digest_sha256": null
      },
      "response": {
        "status": 200,
        "headers": {
          "content-type": "application/json"
        },
        "body_encoding": "json",
        "body": {
          "body": "Safari spinner flickers during widget refresh cycles.",
          "labels": [],
          "comments": 0,
          "html_url": "https://github.com/acme/widgets/issues/50",
          "created_at": "2026-01-01T00:00:00Z",
          "updated_at": "2026-01-02T00:00:00Z",
          "closed_at": null,
          "assignees": [],
          "number": 50,
          "title": "widget spinner flickers on safari",
          "state": "open"
        }
      }
    },
    {
      "sequence": 1,
      "provider": "github",
      "match": {
        "method": "GET",
        "canonical_url": "https://api.github.com/repos/acme/widgets",
        "request_body_digest_sha256": null
      },
      "response": {
        "status": 200,
        "headers": {
          "content-type": "application/json"
        },
        "body_encoding": "json",
        "body": {
          "full_name": "acme/widgets",
          "default_branch": "main",
          "html_url": "https://github.com/acme/widgets"
        }
      }
    },
    {
      "sequence": 2,
      "provider": "github",
      "match": {
        "method": "GET",
        "canonical_url": "https://api.github.com/search/issues?per_page=50&q=repo%3Aacme%2Fwidgets%20is%3Aissue%20widget%20spinner%20flickers%20safari",
        "request_body_digest_sha256": null
      },
      "response": {
        "status": 200,
        "headers": {
          "content-type": "application/json"
        },
        "body_encoding": "json",
        "body": {
          "total_count": 2,
          "incomplete_results": false,
          "items": [
            {
              "body": "Safari spinner flickers during widget refresh cycles.",
              "labels": [],
              "comments": 0,
              "html_url": "https://github.com/acme/widgets/issues/50",
              "created_at": "2026-01-01T00:00:00Z",
              "updated_at": "2026-01-02T00:00:00Z",
              "closed_at": null,
              "assignees": [],
              "number": 50,
              "title": "widget spinner flickers on safari",
              "state": "open"
            },
            {
              "body": "Chrome also shows spinner flicker on widget refresh.",
              "labels": [],
              "comments": 0,
              "html_url": "https://github.com/acme/widgets/issues/51",
              "created_at": "2026-01-01T00:00:00Z",
              "updated_at": "2026-01-02T00:00:00Z",
              "closed_at": null,
              "assignees": [],
              "number": 51,
              "title": "widget spinner flickers chrome too",
              "state": "open"
            }
          ]
        }
      }
    },
    {
      "sequence": 3,
      "provider": "github",
      "match": {
        "method": "GET",
        "canonical_url": "https://api.github.com/repos/acme/widgets/issues?page=1&per_page=50&state=all",
        "request_body_digest_sha256": null
      },
      "response": {
        "status": 200,
        "headers": {
          "content-type": "application/json"
        },
        "body_encoding": "json",
        "body": [
          {
            "body": "Safari spinner flickers during widget refresh cycles.",
            "labels": [],
            "comments": 0,
            "html_url": "https://github.com/acme/widgets/issues/50",
            "created_at": "2026-01-01T00:00:00Z",
            "updated_at": "2026-01-02T00:00:00Z",
            "closed_at": null,
            "assignees": [],
            "number": 50,
            "title": "widget spinner flickers on safari",
            "state": "open"
          },
          {
            "body": "Chrome also shows spinner flicker on widget refresh.",
            "labels": [],
            "comments": 0,
            "html_url": "https://github.com/acme/widgets/issues/51",
            "created_at": "2026-01-01T00:00:00Z",
            "updated_at": "2026-01-02T00:00:00Z",
            "closed_at": null,
            "assignees": [],
            "number": 51,
            "title": "widget spinner flickers chrome too",
            "state": "open"
          }
        ]
      }
    }
  ],
  "git_probes": []
}
