{
  "schema_version": "1.0-draft.1",
  "fixture_version": 1,
  "case_id": "frozen-worth-verify-assigned",
  "attributed_from": {
    "notes": "GW-024 synthetic offline promotion pack"
  },
  "http_exchanges": [
    {
      "sequence": 1,
      "provider": "github",
      "match": {
        "method": "GET",
        "canonical_url": "https://api.github.com/repos/acme/widgets",
        "request_body_digest_sha256": null
      },
      "response": {
        "status": 200,
        "headers": {
          "content-type": "application/json"
        },
        "body_encoding": "json",
        "body": {
          "full_name": "acme/widgets",
          "default_branch": "main",
          "html_url": "https://github.com/acme/widgets"
        }
      }
    },
    {
      "sequence": 2,
      "provider": "github",
      "match": {
        "method": "GET",
        "canonical_url": "https://api.github.com/repos/acme/widgets/issues/302",
        "request_body_digest_sha256": null
      },
      "response": {
        "status": 200,
        "headers": {
          "content-type": "application/json"
        },
        "body_encoding": "json",
        "body": {
          "body": "assigned worth verify path",
          "labels": [],
          "comments": 0,
          "html_url": "https://github.com/acme/widgets/issues/302",
          "created_at": "2026-01-01T00:00:00Z",
          "updated_at": "2026-01-02T00:00:00Z",
          "closed_at": null,
          "assignees": [
            {
              "login": "maintainer-alice"
            }
          ],
          "number": 302,
          "title": "assigned worth verify path",
          "state": "open"
        }
      }
    },
    {
      "sequence": 3,
      "provider": "github",
      "match": {
        "method": "GET",
        "canonical_url": "https://api.github.com/repos/acme/widgets/issues/302/timeline?per_page=100&page=1",
        "request_body_digest_sha256": null
      },
      "response": {
        "status": 200,
        "headers": {
          "content-type": "application/json"
        },
        "body_encoding": "json",
        "body": [
          {
            "event": "assigned",
            "created_at": "2026-01-02T00:00:00Z",
            "assignee": {
              "login": "maintainer-alice"
            },
            "actor": {
              "login": "lead"
            }
          }
        ]
      }
    },
    {
      "sequence": 4,
      "provider": "github",
      "match": {
        "method": "GET",
        "canonical_url": "https://api.github.com/repos/acme/widgets/issues/302/comments?per_page=100",
        "request_body_digest_sha256": null
      },
      "response": {
        "status": 200,
        "headers": {
          "content-type": "application/json"
        },
        "body_encoding": "json",
        "body": []
      }
    },
    {
      "sequence": 5,
      "provider": "github",
      "match": {
        "method": "GET",
        "canonical_url": "https://api.github.com/search/issues?per_page=20&q=repo%3Aacme%2Fwidgets%20is%3Apr%20302",
        "request_body_digest_sha256": null
      },
      "response": {
        "status": 200,
        "headers": {
          "content-type": "application/json"
        },
        "body_encoding": "json",
        "body": {
          "total_count": 0,
          "incomplete_results": false,
          "items": []
        }
      }
    },
    {
      "sequence": 21,
      "provider": "github",
      "match": {
        "method": "GET",
        "canonical_url": "https://api.github.com/search/issues?per_page=20&q=repo%3Aacme%2Fwidgets%20is%3Apr%20is%3Aopen%20assigned%20worth%20verify",
        "request_body_digest_sha256": null
      },
      "response": {
        "status": 200,
        "headers": {
          "content-type": "application/json"
        },
        "body_encoding": "json",
        "body": {
          "total_count": 0,
          "incomplete_results": false,
          "items": []
        }
      }
    },
    {
      "sequence": 6,
      "provider": "github",
      "match": {
        "method": "GET",
        "canonical_url": "https://api.github.com/search/issues?per_page=20&q=is%3Apr%20(%22Fixes%20%23302%22%20OR%20%22Closes%20%23302%22%20OR%20%22Resolves%20%23302%22%20OR%20%22%23302%22)%20org%3Aacme",
        "request_body_digest_sha256": null
      },
      "response": {
        "status": 200,
        "headers": {
          "content-type": "application/json"
        },
        "body_encoding": "json",
        "body": {
          "total_count": 0,
          "incomplete_results": false,
          "items": []
        }
      }
    },
    {
      "sequence": 7,
      "provider": "github",
      "match": {
        "method": "GET",
        "canonical_url": "https://api.github.com/search/issues?per_page=20&q=is%3Apr%20(%22Fixes%20%23302%22%20OR%20%22Closes%20%23302%22%20OR%20%22Resolves%20%23302%22%20OR%20%22%23302%22)%20user%3Aacme",
        "request_body_digest_sha256": null
      },
      "response": {
        "status": 200,
        "headers": {
          "content-type": "application/json"
        },
        "body_encoding": "json",
        "body": {
          "total_count": 0,
          "incomplete_results": false,
          "items": []
        }
      }
    },
    {
      "sequence": 8,
      "provider": "github",
      "match": {
        "method": "GET",
        "canonical_url": "https://api.github.com/repos/acme/widgets",
        "request_body_digest_sha256": null
      },
      "response": {
        "status": 200,
        "headers": {
          "content-type": "application/json"
        },
        "body_encoding": "json",
        "body": {
          "full_name": "acme/widgets",
          "default_branch": "main",
          "html_url": "https://github.com/acme/widgets"
        }
      }
    },
    {
      "sequence": 9,
      "provider": "github",
      "match": {
        "method": "GET",
        "canonical_url": "https://raw.githubusercontent.com/acme/widgets/main/CONTRIBUTING.md",
        "request_body_digest_sha256": null
      },
      "response": {
        "status": 404,
        "headers": {},
        "body_encoding": "omitted"
      }
    },
    {
      "sequence": 10,
      "provider": "github",
      "match": {
        "method": "GET",
        "canonical_url": "https://raw.githubusercontent.com/acme/widgets/main/.github/CONTRIBUTING.md",
        "request_body_digest_sha256": null
      },
      "response": {
        "status": 404,
        "headers": {},
        "body_encoding": "omitted"
      }
    },
    {
      "sequence": 11,
      "provider": "github",
      "match": {
        "method": "GET",
        "canonical_url": "https://raw.githubusercontent.com/acme/widgets/main/AGENTS.md",
        "request_body_digest_sha256": null
      },
      "response": {
        "status": 404,
        "headers": {},
        "body_encoding": "omitted"
      }
    },
    {
      "sequence": 12,
      "provider": "github",
      "match": {
        "method": "GET",
        "canonical_url": "https://raw.githubusercontent.com/acme/widgets/main/AI_POLICY.md",
        "request_body_digest_sha256": null
      },
      "response": {
        "status": 404,
        "headers": {},
        "body_encoding": "omitted"
      }
    },
    {
      "sequence": 13,
      "provider": "github",
      "match": {
        "method": "GET",
        "canonical_url": "https://raw.githubusercontent.com/acme/widgets/main/CODE_OF_CONDUCT.md",
        "request_body_digest_sha256": null
      },
      "response": {
        "status": 404,
        "headers": {},
        "body_encoding": "omitted"
      }
    },
    {
      "sequence": 14,
      "provider": "github",
      "match": {
        "method": "GET",
        "canonical_url": "https://raw.githubusercontent.com/acme/widgets/main/.github/PULL_REQUEST_TEMPLATE.md",
        "request_body_digest_sha256": null
      },
      "response": {
        "status": 404,
        "headers": {},
        "body_encoding": "omitted"
      }
    },
    {
      "sequence": 15,
      "provider": "github",
      "match": {
        "method": "GET",
        "canonical_url": "https://raw.githubusercontent.com/acme/widgets/main/SECURITY.md",
        "request_body_digest_sha256": null
      },
      "response": {
        "status": 404,
        "headers": {},
        "body_encoding": "omitted"
      }
    },
    {
      "sequence": 16,
      "provider": "github",
      "match": {
        "method": "GET",
        "canonical_url": "https://api.github.com/repos/acme/widgets/issues/302",
        "request_body_digest_sha256": null
      },
      "response": {
        "status": 200,
        "headers": {
          "content-type": "application/json"
        },
        "body_encoding": "json",
        "body": {
          "body": "assigned worth verify path",
          "labels": [],
          "comments": 0,
          "html_url": "https://github.com/acme/widgets/issues/302",
          "created_at": "2026-01-01T00:00:00Z",
          "updated_at": "2026-01-02T00:00:00Z",
          "closed_at": null,
          "assignees": [
            {
              "login": "maintainer-alice"
            }
          ],
          "number": 302,
          "title": "assigned worth verify path",
          "state": "open"
        }
      }
    }
  ],
  "git_probes": [
    {
      "sequence": 1,
      "kind": "ls_remote_heads",
      "match": {
        "repo": "acme/widgets"
      },
      "response": {
        "heads": [
          {
            "name": "main",
            "sha": "aaa111"
          }
        ]
      }
    }
  ]
}
