{
  "schema_version": "1.0-draft.1",
  "fixture_version": 1,
  "case_id": "frozen-dupe-closed-title-gate",
  "attributed_from": {
    "notes": "GW-024 synthetic offline promotion pack"
  },
  "http_exchanges": [
    {
      "sequence": 0,
      "provider": "github",
      "match": {
        "method": "GET",
        "canonical_url": "https://api.github.com/repos/acme/widgets/issues/10",
        "request_body_digest_sha256": null
      },
      "response": {
        "status": 200,
        "headers": {
          "content-type": "application/json"
        },
        "body_encoding": "json",
        "body": {
          "body": "Users hit timeout retry backoff storm when the gateway flaps.",
          "labels": [],
          "comments": 0,
          "html_url": "https://github.com/acme/widgets/issues/10",
          "created_at": "2026-01-01T00:00:00Z",
          "updated_at": "2026-01-02T00:00:00Z",
          "closed_at": null,
          "number": 10,
          "title": "timeout retry backoff storm",
          "state": "open"
        }
      }
    },
    {
      "sequence": 1,
      "provider": "github",
      "match": {
        "method": "GET",
        "canonical_url": "https://api.github.com/repos/acme/widgets",
        "request_body_digest_sha256": null
      },
      "response": {
        "status": 200,
        "headers": {
          "content-type": "application/json"
        },
        "body_encoding": "json",
        "body": {
          "full_name": "acme/widgets",
          "default_branch": "main",
          "html_url": "https://github.com/acme/widgets"
        }
      }
    },
    {
      "sequence": 2,
      "provider": "github",
      "match": {
        "method": "GET",
        "canonical_url": "https://api.github.com/search/issues?per_page=50&q=repo%3Aacme%2Fwidgets+is%3Aissue+timeout+retry+backoff+storm",
        "request_body_digest_sha256": null
      },
      "response": {
        "status": 200,
        "headers": {
          "content-type": "application/json"
        },
        "body_encoding": "json",
        "body": {
          "total_count": 1,
          "incomplete_results": false,
          "items": [
            {
              "body": "Users hit timeout retry backoff storm when the gateway flaps.",
              "labels": [],
              "comments": 0,
              "html_url": "https://github.com/acme/widgets/issues/11",
              "created_at": "2026-01-01T00:00:00Z",
              "updated_at": "2026-01-02T00:00:00Z",
              "closed_at": "2026-01-03T00:00:00Z",
              "number": 11,
              "title": "totally different title about caching",
              "state": "closed"
            }
          ]
        }
      }
    },
    {
      "sequence": 3,
      "provider": "github",
      "match": {
        "method": "GET",
        "canonical_url": "https://api.github.com/repos/acme/widgets/issues?page=1&per_page=50&state=all",
        "request_body_digest_sha256": null
      },
      "response": {
        "status": 200,
        "headers": {
          "content-type": "application/json"
        },
        "body_encoding": "json",
        "body": [
          {
            "body": "Users hit timeout retry backoff storm when the gateway flaps.",
            "labels": [],
            "comments": 0,
            "html_url": "https://github.com/acme/widgets/issues/10",
            "created_at": "2026-01-01T00:00:00Z",
            "updated_at": "2026-01-02T00:00:00Z",
            "closed_at": null,
            "number": 10,
            "title": "timeout retry backoff storm",
            "state": "open"
          },
          {
            "body": "Users hit timeout retry backoff storm when the gateway flaps.",
            "labels": [],
            "comments": 0,
            "html_url": "https://github.com/acme/widgets/issues/11",
            "created_at": "2026-01-01T00:00:00Z",
            "updated_at": "2026-01-02T00:00:00Z",
            "closed_at": "2026-01-03T00:00:00Z",
            "number": 11,
            "title": "totally different title about caching",
            "state": "closed"
          }
        ]
      }
    }
  ],
  "git_probes": []
}
