{
  "schema_version": "1.0-draft.1",
  "fixture_version": 1,
  "case_id": "frozen-smoke-dupe",
  "attributed_from": {
    "notes": "Hand-authored offline smoke pack for GW-021/GW-022. Not promoted from a live capture."
  },
  "http_exchanges": [
    {
      "sequence": 0,
      "provider": "github",
      "match": {
        "method": "GET",
        "canonical_url": "https://api.github.com/repos/acme/widgets/issues/1",
        "request_body_digest_sha256": null
      },
      "response": {
        "status": 200,
        "headers": {
          "content-type": "application/json"
        },
        "body_encoding": "json",
        "body": {
          "number": 1,
          "title": "duplicate login timeout bug",
          "body": "Users hit a duplicate login timeout bug when refreshing tokens.",
          "state": "open",
          "labels": [],
          "comments": 0,
          "html_url": "https://github.com/acme/widgets/issues/1",
          "created_at": "2026-01-01T00:00:00Z",
          "updated_at": "2026-01-02T00:00:00Z",
          "closed_at": null
        }
      }
    },
    {
      "sequence": 1,
      "provider": "github",
      "match": {
        "method": "GET",
        "canonical_url": "https://api.github.com/repos/acme/widgets",
        "request_body_digest_sha256": null
      },
      "response": {
        "status": 200,
        "headers": {
          "content-type": "application/json"
        },
        "body_encoding": "json",
        "body": {
          "full_name": "acme/widgets",
          "default_branch": "main",
          "html_url": "https://github.com/acme/widgets"
        }
      }
    },
    {
      "sequence": 2,
      "provider": "github",
      "match": {
        "method": "GET",
        "canonical_url": "https://api.github.com/search/issues?per_page=50&q=repo%3Aacme%2Fwidgets+is%3Aissue+duplicate+login+timeout",
        "request_body_digest_sha256": null
      },
      "response": {
        "status": 200,
        "headers": {
          "content-type": "application/json"
        },
        "body_encoding": "json",
        "body": {
          "total_count": 2,
          "incomplete_results": false,
          "items": [
            {
              "number": 1,
              "title": "duplicate login timeout bug",
              "body": "Users hit a duplicate login timeout bug when refreshing tokens.",
              "state": "open",
              "labels": [],
              "comments": 0,
              "html_url": "https://github.com/acme/widgets/issues/1",
              "created_at": "2026-01-01T00:00:00Z",
              "updated_at": "2026-01-02T00:00:00Z",
              "closed_at": null
            },
            {
              "number": 2,
              "title": "duplicate login timeout bug",
              "body": "Users hit a duplicate login timeout bug when refreshing tokens.",
              "state": "open",
              "labels": [],
              "comments": 0,
              "html_url": "https://github.com/acme/widgets/issues/2",
              "created_at": "2026-01-03T00:00:00Z",
              "updated_at": "2026-01-03T00:00:00Z",
              "closed_at": null
            }
          ]
        }
      }
    },
    {
      "sequence": 3,
      "provider": "github",
      "match": {
        "method": "GET",
        "canonical_url": "https://api.github.com/repos/acme/widgets/issues?page=1&per_page=50&state=all",
        "request_body_digest_sha256": null
      },
      "response": {
        "status": 200,
        "headers": {
          "content-type": "application/json"
        },
        "body_encoding": "json",
        "body": [
          {
            "number": 1,
            "title": "duplicate login timeout bug",
            "body": "Users hit a duplicate login timeout bug when refreshing tokens.",
            "state": "open",
            "labels": [],
            "comments": 0,
            "html_url": "https://github.com/acme/widgets/issues/1",
            "created_at": "2026-01-01T00:00:00Z",
            "updated_at": "2026-01-02T00:00:00Z",
            "closed_at": null
          },
          {
            "number": 2,
            "title": "duplicate login timeout bug",
            "body": "Users hit a duplicate login timeout bug when refreshing tokens.",
            "state": "open",
            "labels": [],
            "comments": 0,
            "html_url": "https://github.com/acme/widgets/issues/2",
            "created_at": "2026-01-03T00:00:00Z",
            "updated_at": "2026-01-03T00:00:00Z",
            "closed_at": null
          }
        ]
      }
    }
  ],
  "git_probes": []
}
