{
  "schema_version": "1.0-draft.1",
  "fixture_version": 1,
  "case_id": "frozen-worth-rate-limit-verify",
  "attributed_from": {
    "notes": "GW-024 synthetic offline promotion pack"
  },
  "http_exchanges": [
    {
      "sequence": 0,
      "provider": "github",
      "match": {
        "method": "GET",
        "canonical_url": "https://api.github.com/repos/acme/widgets/issues/303",
        "request_body_digest_sha256": null
      },
      "response": {
        "status": 200,
        "headers": {
          "content-type": "application/json"
        },
        "body_encoding": "json",
        "body": {
          "body": "rate limit verify path",
          "labels": [],
          "comments": 0,
          "html_url": "https://github.com/acme/widgets/issues/303",
          "created_at": "2026-01-01T00:00:00Z",
          "updated_at": "2026-01-02T00:00:00Z",
          "closed_at": null,
          "assignees": [],
          "number": 303,
          "title": "rate limit verify path",
          "state": "open"
        }
      }
    },
    {
      "sequence": 1,
      "provider": "github",
      "match": {
        "method": "GET",
        "canonical_url": "https://api.github.com/repos/acme/widgets",
        "request_body_digest_sha256": null
      },
      "response": {
        "status": 200,
        "headers": {
          "content-type": "application/json"
        },
        "body_encoding": "json",
        "body": {
          "full_name": "acme/widgets",
          "default_branch": "main",
          "html_url": "https://github.com/acme/widgets"
        }
      }
    },
    {
      "sequence": 2,
      "provider": "github",
      "match": {
        "method": "GET",
        "canonical_url": "https://api.github.com/repos/acme/widgets/issues/303/timeline?per_page=100&page=1",
        "request_body_digest_sha256": null
      },
      "response": {
        "status": 403,
        "headers": {
          "content-type": "application/json",
          "x-ratelimit-remaining": "0",
          "x-ratelimit-reset": "4102444800"
        },
        "body_encoding": "json",
        "body": {
          "message": "API rate limit exceeded"
        }
      }
    },
    {
      "sequence": 3,
      "provider": "github",
      "match": {
        "method": "GET",
        "canonical_url": "https://raw.githubusercontent.com/acme/widgets/main/CONTRIBUTING.md",
        "request_body_digest_sha256": null
      },
      "response": {
        "status": 404,
        "headers": {},
        "body_encoding": "omitted"
      }
    },
    {
      "sequence": 4,
      "provider": "github",
      "match": {
        "method": "GET",
        "canonical_url": "https://raw.githubusercontent.com/acme/widgets/main/.github/CONTRIBUTING.md",
        "request_body_digest_sha256": null
      },
      "response": {
        "status": 404,
        "headers": {},
        "body_encoding": "omitted"
      }
    },
    {
      "sequence": 5,
      "provider": "github",
      "match": {
        "method": "GET",
        "canonical_url": "https://raw.githubusercontent.com/acme/widgets/main/AGENTS.md",
        "request_body_digest_sha256": null
      },
      "response": {
        "status": 404,
        "headers": {},
        "body_encoding": "omitted"
      }
    },
    {
      "sequence": 6,
      "provider": "github",
      "match": {
        "method": "GET",
        "canonical_url": "https://raw.githubusercontent.com/acme/widgets/main/AI_POLICY.md",
        "request_body_digest_sha256": null
      },
      "response": {
        "status": 404,
        "headers": {},
        "body_encoding": "omitted"
      }
    },
    {
      "sequence": 7,
      "provider": "github",
      "match": {
        "method": "GET",
        "canonical_url": "https://raw.githubusercontent.com/acme/widgets/main/CODE_OF_CONDUCT.md",
        "request_body_digest_sha256": null
      },
      "response": {
        "status": 404,
        "headers": {},
        "body_encoding": "omitted"
      }
    },
    {
      "sequence": 8,
      "provider": "github",
      "match": {
        "method": "GET",
        "canonical_url": "https://raw.githubusercontent.com/acme/widgets/main/.github/PULL_REQUEST_TEMPLATE.md",
        "request_body_digest_sha256": null
      },
      "response": {
        "status": 404,
        "headers": {},
        "body_encoding": "omitted"
      }
    },
    {
      "sequence": 9,
      "provider": "github",
      "match": {
        "method": "GET",
        "canonical_url": "https://raw.githubusercontent.com/acme/widgets/main/SECURITY.md",
        "request_body_digest_sha256": null
      },
      "response": {
        "status": 404,
        "headers": {},
        "body_encoding": "omitted"
      }
    },
    {
      "sequence": 10,
      "provider": "github",
      "match": {
        "method": "GET",
        "canonical_url": "https://api.github.com/repos/acme/widgets/issues/303",
        "request_body_digest_sha256": null
      },
      "response": {
        "status": 200,
        "headers": {
          "content-type": "application/json"
        },
        "body_encoding": "json",
        "body": {
          "body": "rate limit verify path",
          "labels": [],
          "comments": 0,
          "html_url": "https://github.com/acme/widgets/issues/303",
          "created_at": "2026-01-01T00:00:00Z",
          "updated_at": "2026-01-02T00:00:00Z",
          "closed_at": null,
          "assignees": [],
          "number": 303,
          "title": "rate limit verify path",
          "state": "open"
        }
      }
    },
    {
      "sequence": 11,
      "provider": "github",
      "match": {
        "method": "GET",
        "canonical_url": "https://api.github.com/repos/acme/widgets/issues/303",
        "request_body_digest_sha256": null
      },
      "response": {
        "status": 200,
        "headers": {
          "content-type": "application/json"
        },
        "body_encoding": "json",
        "body": {
          "body": "rate limit verify path",
          "labels": [],
          "comments": 0,
          "html_url": "https://github.com/acme/widgets/issues/303",
          "created_at": "2026-01-01T00:00:00Z",
          "updated_at": "2026-01-02T00:00:00Z",
          "closed_at": null,
          "assignees": [],
          "number": 303,
          "title": "rate limit verify path",
          "state": "open"
        }
      }
    },
    {
      "sequence": 12,
      "provider": "github",
      "match": {
        "method": "GET",
        "canonical_url": "https://api.github.com/repos/acme/widgets",
        "request_body_digest_sha256": null
      },
      "response": {
        "status": 200,
        "headers": {
          "content-type": "application/json"
        },
        "body_encoding": "json",
        "body": {
          "full_name": "acme/widgets",
          "default_branch": "main",
          "html_url": "https://github.com/acme/widgets"
        }
      }
    },
    {
      "sequence": 13,
      "provider": "github",
      "match": {
        "method": "GET",
        "canonical_url": "https://api.github.com/search/issues?per_page=50&q=repo%3Aacme%2Fwidgets%20is%3Aissue%20rate%20limit%20verify%20path",
        "request_body_digest_sha256": null
      },
      "response": {
        "status": 200,
        "headers": {
          "content-type": "application/json"
        },
        "body_encoding": "json",
        "body": {
          "total_count": 1,
          "incomplete_results": false,
          "items": [
            {
              "body": "rate limit verify path",
              "labels": [],
              "comments": 0,
              "html_url": "https://github.com/acme/widgets/issues/303",
              "created_at": "2026-01-01T00:00:00Z",
              "updated_at": "2026-01-02T00:00:00Z",
              "closed_at": null,
              "assignees": [],
              "number": 303,
              "title": "rate limit verify path",
              "state": "open"
            }
          ]
        }
      }
    },
    {
      "sequence": 14,
      "provider": "github",
      "match": {
        "method": "GET",
        "canonical_url": "https://api.github.com/repos/acme/widgets/issues?page=1&per_page=50&state=all",
        "request_body_digest_sha256": null
      },
      "response": {
        "status": 200,
        "headers": {
          "content-type": "application/json"
        },
        "body_encoding": "json",
        "body": [
          {
            "body": "rate limit verify path",
            "labels": [],
            "comments": 0,
            "html_url": "https://github.com/acme/widgets/issues/303",
            "created_at": "2026-01-01T00:00:00Z",
            "updated_at": "2026-01-02T00:00:00Z",
            "closed_at": null,
            "assignees": [],
            "number": 303,
            "title": "rate limit verify path",
            "state": "open"
          }
        ]
      }
    }
  ],
  "git_probes": [
    {
      "sequence": 1,
      "kind": "ls_remote_heads",
      "match": {
        "repo": "acme/widgets"
      },
      "response": {
        "heads": [
          {
            "name": "main",
            "sha": "aaa111"
          }
        ]
      }
    }
  ]
}
